{
  "format_version": "1.0.0",
  "rubric_version": "0.1.0",
  "research_object": {
    "title": "REMoDNaV: research object for the paper",
    "locator": "https://github.com/psychoinformatics-de/paper-remodnav",
    "revision": "34388d3ca78fbd483e022e4e2851be390b7eebf2",
    "scope": "Reproduce the computational numerical results, figures and manuscript using the maintained containerized workflow and explicitly linked input datasets. The boundary includes pinned modules and their declared dependencies; recollecting participant measurements is outside scope."
  },
  "assessments": [
    {
      "id": "remodnav-initial",
      "reviewer": {
        "id": "codex-initial",
        "name": "Codex — initial source review"
      },
      "created_at": "2026-10-27T22:27:51Z",
      "updated_at": "2026-10-27T22:37:16Z",
      "review_of": null,
      "weights": {
        "S": 1,
        "T": 1,
        "A": 1,
        "M": 1,
        "P": 1,
        "E": 1,
        "D": 1
      },
      "responses": {
        "S-01": {
          "score": 3,
          "evidence": [
            {
              "locator": "https://github.com/psychoinformatics-de/paper-remodnav/blob/34388d3ca78fbd483e022e4e2851be390b7eebf2/README.md#updated-instructions-for-computing-the-results-and-building-the-manuscript",
              "description": "Names the computational scope, required host tools and versions, linked installation guidance, data/image sizes, replay command, expected unchanged-tree check and manuscript build command. Reports cross-platform verification and a minor difference from the original publication.",
              "discovery_path": "Entry repository → README.md → updated reproduction instructions",
              "access_status": "accessible"
            },
            {
              "locator": "https://github.com/psychoinformatics-de/paper-remodnav/blob/34388d3ca78fbd483e022e4e2851be390b7eebf2/.gitmodules",
              "description": "Declares raw eye-gaze, eye-movement-label and REMoDNaV module URLs; the root Git tree fixes their respective commits.",
              "discovery_path": "Entry repository → .gitmodules and pinned Git tree",
              "access_status": "accessible"
            },
            {
              "locator": "https://github.com/psychoinformatics-de/remodnav/blob/d28911838f91f33af0db57332f55ccc442d24f66/.gitmodules",
              "description": "The pinned code module explicitly links the Anderson eye-movement data module; its Git tree fixes that nested module at 0e6f82708e10b48039763aa1078696e802260674.",
              "discovery_path": "Entry repository → remodnav submodule → pinned .gitmodules and Git tree",
              "access_status": "accessible"
            }
          ],
          "rationale": "The README defines the reproducible results and the root’s explicit module references lead to all identified data/code components, including the nested Anderson data. The environment is in the same object.",
          "evidence_rating": "sufficient",
          "confidence": "moderate",
          "feedback": "",
          "priority": false,
          "observation": "observed"
        },
        "S-02": {
          "score": 3,
          "evidence": [
            {
              "locator": "https://github.com/psychoinformatics-de/paper-remodnav/blob/34388d3ca78fbd483e022e4e2851be390b7eebf2/.gitmodules",
              "description": "Declares raw eye-gaze, eye-movement-label and REMoDNaV module URLs; the root Git tree fixes their respective commits.",
              "discovery_path": "Entry repository → .gitmodules and pinned Git tree",
              "access_status": "accessible"
            },
            {
              "locator": "https://github.com/psychoinformatics-de/remodnav/blob/d28911838f91f33af0db57332f55ccc442d24f66/.gitmodules",
              "description": "The pinned code module explicitly links the Anderson eye-movement data module; its Git tree fixes that nested module at 0e6f82708e10b48039763aa1078696e802260674.",
              "discovery_path": "Entry repository → remodnav submodule → pinned .gitmodules and Git tree",
              "access_status": "accessible"
            },
            {
              "locator": "https://github.com/psychoinformatics-de/paper-remodnav/blob/34388d3ca78fbd483e022e4e2851be390b7eebf2/code/mk_figuresnstats.py",
              "description": "Defines the analysis, data paths, output paths, command-line switches and defaults. It imports remodnav.tests.utils and directly accesses the module’s nested test-data layout.",
              "discovery_path": "Entry repository → Docker-Makefile → code/mk_figuresnstats.py",
              "access_status": "accessible"
            }
          ],
          "rationale": "The data sources used by the analysis are explicit module references, and the analysis code itself is included. No essential data/code item outside these references was identified within the declared scope.",
          "evidence_rating": "sufficient",
          "confidence": "moderate",
          "feedback": "",
          "priority": false,
          "observation": "observed"
        },
        "S-03": {
          "score": 3,
          "evidence": [
            {
              "locator": "https://github.com/psychoinformatics-de/paper-remodnav/blob/34388d3ca78fbd483e022e4e2851be390b7eebf2/container/Dockerfile",
              "description": "Builds from debian:bookworm-slim; installs system dependencies without versions and pins numpy, pandas, seaborn and matplotlib. The build inputs are not fully frozen.",
              "discovery_path": "Entry repository → container/ → Dockerfile",
              "access_status": "accessible"
            },
            {
              "locator": "https://github.com/psychoinformatics-de/paper-remodnav/blob/34388d3ca78fbd483e022e4e2851be390b7eebf2/.datalad/config",
              "description": "The docker-make specification uses container/image, mounts the workspace through the Docker adapter, creates a temporary HOME and removes it after successful Make execution; the Python executable is an explicit substitution.",
              "discovery_path": "Entry repository → .datalad/config",
              "access_status": "accessible"
            },
            {
              "locator": "https://github.com/psychoinformatics-de/paper-remodnav/blob/34388d3ca78fbd483e022e4e2851be390b7eebf2/code/mk_figuresnstats.py",
              "description": "Defines the analysis, data paths, output paths, command-line switches and defaults. It imports remodnav.tests.utils and directly accesses the module’s nested test-data layout.",
              "discovery_path": "Entry repository → Docker-Makefile → code/mk_figuresnstats.py",
              "access_status": "accessible"
            }
          ],
          "rationale": "The saved environment, its recipe, execution configuration and analysis switches/defaults are included. The host-side orchestration tools and installation routes are named in the README. This is a boundary finding, not a claim that rebuilding is bit-reproducible.",
          "evidence_rating": "sufficient",
          "confidence": "moderate",
          "feedback": "",
          "priority": false,
          "observation": "observed"
        },
        "S-04": {
          "score": 2,
          "evidence": [
            {
              "locator": "https://github.com/psychoinformatics-de/paper-remodnav/blob/34388d3ca78fbd483e022e4e2851be390b7eebf2/COPYING",
              "description": "The root provides the full Creative Commons Attribution 4.0 International terms, without a complete independent mapping of every linked/bundled component license.",
              "discovery_path": "Entry repository → COPYING",
              "access_status": "accessible"
            },
            {
              "locator": "https://github.com/psychoinformatics-de/remodnav/blob/d28911838f91f33af0db57332f55ccc442d24f66/LICENSE",
              "description": "The pinned REMoDNaV module declares the MIT license for its code, examples and documentation.",
              "discovery_path": "Entry repository → .gitmodules remodnav → pinned module LICENSE",
              "access_status": "accessible"
            },
            {
              "locator": "https://github.com/psychoinformatics-de/studyforrest-data-eyemovementlabels/tree/92279db3850ee4282d97001a3f650fc55cb64b4e",
              "description": "The pinned labels module has a README and computational/data files. No license-named file or module-level licensing statement was found in its inspected tree and README.",
              "discovery_path": "Entry repository → .gitmodules data/studyforrest-data-eyemovementlabels → pinned module tree and README",
              "access_status": "accessible"
            }
          ],
          "rationale": "Root, code-module, raw-data and nested-data license declarations are reachable, but a declaration for the labels module and complete bundled-component coverage were not found. This supports partial coverage rather than a legal finding of missing rights.",
          "evidence_rating": "sufficient",
          "confidence": "moderate",
          "feedback": "Separate reachability of existing declarations from completeness of license coverage; the same license gap also affects M-03 and D-04.",
          "priority": true,
          "observation": "observed"
        },
        "T-01": {
          "score": 3,
          "evidence": [
            {
              "locator": "https://github.com/psychoinformatics-de/paper-remodnav/tree/34388d3ca78fbd483e022e4e2851be390b7eebf2",
              "description": "The pinned root includes code, figures, numerical-result definitions, manuscript, Dockerfile, OCI image manifests and Git submodule references.",
              "discovery_path": "Entry repository → Git tree at assessed revision",
              "access_status": "accessible"
            },
            {